{
  "schemaVersion": "manifest.v1",
  "corpusId": "corpus-golden-synthetic-0001",
  "nearDuplicateGraphVersion": "phash-graph.v1",
  "samples": [
    {
      "sampleId": "sample-golden-ammo-1-0010",
      "evidenceClass": "synthetic-raster",
      "splitUnitId": "9ef3ed49f4ccbbdd036436b63c45b2bdd9a791dc74a69404bb20fa2383f84065",
      "content": {
        "decodedPixelSha256": "abdd93781a751d25556da6c66126310175bde9544a07dee97e8700ab61bcb46f",
        "nearDuplicateIds": []
      },
      "consentHash": null,
      "privacyReviewHash": null,
      "provenance": {
        "schemaVersion": "provenance.v1",
        "captureIntentId": "intent-v1-ammo-items",
        "sessionId": "session-sample-golden-ammo-1-0010",
        "correlationId": "correlation-sample-golden-ammo-1-0010",
        "captureOrdinal": 0,
        "workspaceId": null,
        "profileId": null,
        "mapId": null,
        "floorId": null,
        "planId": null,
        "objectiveIds": [],
        "selectedReference": null,
        "priorScanReference": null,
        "deviceClass": "desktop",
        "surface": "user-screenshot",
        "resolution": {
          "width": 1920,
          "height": 1080
        },
        "uiScale": 1,
        "locale": "en-US",
        "gameVersion": "0.16.9-golden",
        "companionUiVersion": "2.0.0-golden"
      },
      "lineage": {
        "sequenceId": "sequence-sample-golden-ammo-1-0010",
        "frameOrdinal": 0,
        "viewportId": "viewport-golden-00001",
        "containerIdentity": "container-golden-00001",
        "overlapWithPrevious": 0,
        "parentContainerIdentity": null
      },
      "truth": {
        "claims": [
          {
            "truthId": "truth-golden-ammo-1-item",
            "state": "known",
            "kind": "item",
            "value": "ammo-golden-1",
            "region": null
          }
        ]
      }
    },
    {
      "sampleId": "sample-golden-ammo-2-0003",
      "evidenceClass": "synthetic-raster",
      "splitUnitId": "462e33291f0f3c58793cd261f49d2e630ebf2014ad41b3c02a9a8b062075aa9d",
      "content": {
        "decodedPixelSha256": "ae6cf1ea395a9fd40dc787ed992945320d9b1f7eada14c2423375605b3254949",
        "nearDuplicateIds": []
      },
      "consentHash": null,
      "privacyReviewHash": null,
      "provenance": {
        "schemaVersion": "provenance.v1",
        "captureIntentId": "intent-v1-ammo-items",
        "sessionId": "session-sample-golden-ammo-2-0003",
        "correlationId": "correlation-sample-golden-ammo-2-0003",
        "captureOrdinal": 0,
        "workspaceId": null,
        "profileId": null,
        "mapId": null,
        "floorId": null,
        "planId": null,
        "objectiveIds": [],
        "selectedReference": null,
        "priorScanReference": null,
        "deviceClass": "desktop",
        "surface": "user-screenshot",
        "resolution": {
          "width": 1920,
          "height": 1080
        },
        "uiScale": 1,
        "locale": "en-US",
        "gameVersion": "0.16.9-golden",
        "companionUiVersion": "2.0.0-golden"
      },
      "lineage": {
        "sequenceId": "sequence-sample-golden-ammo-2-0003",
        "frameOrdinal": 0,
        "viewportId": "viewport-golden-00001",
        "containerIdentity": "container-golden-00001",
        "overlapWithPrevious": 0,
        "parentContainerIdentity": null
      },
      "truth": {
        "claims": [
          {
            "truthId": "truth-golden-ammo-2-item",
            "state": "known",
            "kind": "item",
            "value": "ammo-golden-2",
            "region": null
          }
        ]
      }
    },
    {
      "sampleId": "sample-golden-ammo-3-0002",
      "evidenceClass": "synthetic-raster",
      "splitUnitId": "3e014fd5a00885ee28a2d04b96205db0c339184cc32187128b3a215bc58a3847",
      "content": {
        "decodedPixelSha256": "108cbd20e16f40cbedd470717ced9a7611a430fcf4d365cac4b4ea532d307d42",
        "nearDuplicateIds": []
      },
      "consentHash": null,
      "privacyReviewHash": null,
      "provenance": {
        "schemaVersion": "provenance.v1",
        "captureIntentId": "intent-v1-ammo-items",
        "sessionId": "session-sample-golden-ammo-3-0002",
        "correlationId": "correlation-sample-golden-ammo-3-0002",
        "captureOrdinal": 0,
        "workspaceId": null,
        "profileId": null,
        "mapId": null,
        "floorId": null,
        "planId": null,
        "objectiveIds": [],
        "selectedReference": null,
        "priorScanReference": null,
        "deviceClass": "desktop",
        "surface": "user-screenshot",
        "resolution": {
          "width": 1920,
          "height": 1080
        },
        "uiScale": 1,
        "locale": "en-US",
        "gameVersion": "0.16.9-golden",
        "companionUiVersion": "2.0.0-golden"
      },
      "lineage": {
        "sequenceId": "sequence-sample-golden-ammo-3-0002",
        "frameOrdinal": 0,
        "viewportId": "viewport-golden-00001",
        "containerIdentity": "container-golden-00001",
        "overlapWithPrevious": 0,
        "parentContainerIdentity": null
      },
      "truth": {
        "claims": [
          {
            "truthId": "truth-golden-ammo-3-item",
            "state": "known",
            "kind": "item",
            "value": "ammo-golden-3",
            "region": null
          }
        ]
      }
    },
    {
      "sampleId": "sample-golden-ammo-4-0010",
      "evidenceClass": "synthetic-raster",
      "splitUnitId": "e6ce634a5c9353b9043bea27fa11d39e1971dc9621dd9949b2c320c507fcc20e",
      "content": {
        "decodedPixelSha256": "1d0a5588982b1492eb61a435d5fc6a7d197f4b6d84c982059d545164b8639941",
        "nearDuplicateIds": []
      },
      "consentHash": null,
      "privacyReviewHash": null,
      "provenance": {
        "schemaVersion": "provenance.v1",
        "captureIntentId": "intent-v1-ammo-items",
        "sessionId": "session-sample-golden-ammo-4-0010",
        "correlationId": "correlation-sample-golden-ammo-4-0010",
        "captureOrdinal": 0,
        "workspaceId": null,
        "profileId": null,
        "mapId": null,
        "floorId": null,
        "planId": null,
        "objectiveIds": [],
        "selectedReference": null,
        "priorScanReference": null,
        "deviceClass": "desktop",
        "surface": "user-screenshot",
        "resolution": {
          "width": 1920,
          "height": 1080
        },
        "uiScale": 1,
        "locale": "en-US",
        "gameVersion": "0.16.9-golden",
        "companionUiVersion": "2.0.0-golden"
      },
      "lineage": {
        "sequenceId": "sequence-sample-golden-ammo-4-0010",
        "frameOrdinal": 0,
        "viewportId": "viewport-golden-00001",
        "containerIdentity": "container-golden-00001",
        "overlapWithPrevious": 0,
        "parentContainerIdentity": null
      },
      "truth": {
        "claims": [
          {
            "truthId": "truth-golden-ammo-4-item",
            "state": "known",
            "kind": "item",
            "value": "ammo-golden-4",
            "region": null
          }
        ]
      }
    },
    {
      "sampleId": "sample-golden-ammo-5-0005",
      "evidenceClass": "synthetic-raster",
      "splitUnitId": "e62a50c0f336db62b2b374fd6642c6bb4346dfa564a283e062245f87e43838d0",
      "content": {
        "decodedPixelSha256": "26d49b46d645ceabe83393ca6b65e21d66ad6cfbcd185c4b7f363b757241491b",
        "nearDuplicateIds": []
      },
      "consentHash": null,
      "privacyReviewHash": null,
      "provenance": {
        "schemaVersion": "provenance.v1",
        "captureIntentId": "intent-v1-ammo-items",
        "sessionId": "session-sample-golden-ammo-5-0005",
        "correlationId": "correlation-sample-golden-ammo-5-0005",
        "captureOrdinal": 0,
        "workspaceId": null,
        "profileId": null,
        "mapId": null,
        "floorId": null,
        "planId": null,
        "objectiveIds": [],
        "selectedReference": null,
        "priorScanReference": null,
        "deviceClass": "desktop",
        "surface": "user-screenshot",
        "resolution": {
          "width": 1920,
          "height": 1080
        },
        "uiScale": 1,
        "locale": "en-US",
        "gameVersion": "0.16.9-golden",
        "companionUiVersion": "2.0.0-golden"
      },
      "lineage": {
        "sequenceId": "sequence-sample-golden-ammo-5-0005",
        "frameOrdinal": 0,
        "viewportId": "viewport-golden-00001",
        "containerIdentity": "container-golden-00001",
        "overlapWithPrevious": 0,
        "parentContainerIdentity": null
      },
      "truth": {
        "claims": [
          {
            "truthId": "truth-golden-ammo-5-item",
            "state": "known",
            "kind": "item",
            "value": "ammo-golden-5",
            "region": null
          }
        ]
      }
    },
    {
      "sampleId": "sample-golden-loot-seq-f0-0002",
      "evidenceClass": "synthetic-raster",
      "splitUnitId": "eb305a14d10032e5aeadb91cdcb455b84e407c7fde37eedb5e88f075d7732f93",
      "content": {
        "decodedPixelSha256": "d31ced063a4ca61d70e516777a5ff28f6481070252f22f1c7488436fa76af6d7",
        "nearDuplicateIds": []
      },
      "consentHash": null,
      "privacyReviewHash": null,
      "provenance": {
        "schemaVersion": "provenance.v1",
        "captureIntentId": "intent-v1-loot-decision",
        "sessionId": "session-golden-loot-seq-0002",
        "correlationId": "correlation-sample-golden-loot-seq-f0-0002",
        "captureOrdinal": 0,
        "workspaceId": null,
        "profileId": null,
        "mapId": null,
        "floorId": null,
        "planId": null,
        "objectiveIds": [],
        "selectedReference": null,
        "priorScanReference": null,
        "deviceClass": "desktop",
        "surface": "user-screenshot",
        "resolution": {
          "width": 1920,
          "height": 1080
        },
        "uiScale": 1,
        "locale": "en-US",